{
  "skill_name": "wechat-article-review",
  "version": "0.1.3",
  "maturity": "beta",
  "created_at": "2026-05-30T00:00:00Z",
  "updated_at": "2026-05-30T18:00:00Z",
  "baseline": {
    "eval_run_at": "2026-05-30T18:00:00Z",
    "regression_pass_rate": null,
    "capability_pass_rate": 1.0,
    "capability_runs": 2,
    "last_hypothesis": "首评 real_usage 教训写入 Workflow：Blueprint 分流 + 持久化 + 领域示例仅 P2",
    "last_real_usage": {
      "article": "articles/skill-upgrade-sop-wechat.md",
      "score": 9.3,
      "verdict": "pass",
      "report": "reviews/2026-05-30-skill-upgrade-sop-wechat.md"
    },
    "series": {
      "blueprint_v2": 9.2,
      "upgrade_sop_wechat": 9.3
    },
    "notes": "Blueprint v1→v2 闭环：issues 5 fixed + 1 open optional."
  },
  "toolchain": {
    "scaffold": "source/skill-engineering",
    "source_agent": "source/agents/article-reviewer.md",
    "eval_runner": "manual"
  }
}
